{
  "contract_version": "historical-import-workflow/v1",
  "schema_version": "historical-import-workflow-import-request/v1",
  "request_id": "hir_11111111111111111111111111111111",
  "idempotency_key": "hik_11111111111111111111111111111111",
  "confirmation_id": "hic_11111111111111111111111111111111",
  "preview_id": "hip_11111111111111111111111111111111",
  "preview_digest": "sha256:1111111111111111111111111111111111111111111111111111111111111111",
  "snapshot_version": "hsv_1"
}
